{
  "id": "correlation-02",
  "version": 1,
  "family": "correlation",
  "mode": "read_only",
  "repository": {
    "url": "https://github.com/Hugloss/agentsCookbook.git",
    "commit": "844dfa06d50b2f4402306b16a217b29946a3dedf",
    "tree": "c9e4687f45836f0e9254f3d9e6258f737686e76a"
  },
  "prompt": "Inspect benchmark_case/correlation_02. Resolve both observations separately: an ambiguous symbol and an external path that maps to a missing repository member. Return exactly one JSON object with keys symbol_state, missing_path_state, owner; use repository-relative paths and no other text.",
  "mutation": {
    "id": "correlation-02-baseline",
    "artifact": "mutations/correlation-02.patch",
    "sha256": "9b7f6d08116c5f2886fbe4ef5fd74453d65d910b46f55b18365c3c6722bf98c2",
    "changed_paths": [
      "benchmark_case/correlation_02/observation.json",
      "benchmark_case/correlation_02/src/left.py",
      "benchmark_case/correlation_02/src/right.py"
    ]
  },
  "fixtures": [],
  "oracle": {
    "adapter": "command",
    "identity": {
      "id": "correlation-02-oracle",
      "version": "1"
    },
    "configuration": {
      "health_argv": [
        "{python}",
        "{suite}/oracle.py",
        "health",
        "correlation-02"
      ],
      "grade_argv": [
        "{python}",
        "{suite}/oracle.py",
        "grade",
        "correlation-02"
      ],
      "valid_exit_codes": [
        0,
        1
      ],
      "result_format": "lexigram-v1",
      "timeout_seconds": 30
    }
  },
  "budgets": {
    "timeout_seconds": 600,
    "max_tool_calls": 100,
    "max_output_bytes": 50000000
  },
  "contamination": {
    "allowed_change_globs": [],
    "allowed_generated_globs": [
      "**/__pycache__/**",
      ".pytest_cache/**"
    ]
  }
}
