{
  "id": "dependency_delta-02",
  "version": 1,
  "family": "dependency_delta",
  "mode": "read_only",
  "repository": {
    "url": "https://github.com/Hugloss/agentsCookbook.git",
    "commit": "844dfa06d50b2f4402306b16a217b29946a3dedf",
    "tree": "c9e4687f45836f0e9254f3d9e6258f737686e76a"
  },
  "prompt": "Inspect benchmark_case/dependency_delta_02. Compare both uv changes. Separate same-version source selection from a marker-only relationship change. Return exactly one JSON object with keys source_change, marker_change, version_change; use repository-relative paths and no other text.",
  "mutation": {
    "id": "dependency_delta-02-baseline",
    "artifact": "mutations/dependency_delta-02.patch",
    "sha256": "a567e3f36de6d27df3f385ad285145fbdc063aaf2aa949d023e2c5dbc4fe2af5",
    "changed_paths": [
      "benchmark_case/dependency_delta_02/after-marker/pyproject.toml",
      "benchmark_case/dependency_delta_02/after-source/uv.lock",
      "benchmark_case/dependency_delta_02/before/pyproject.toml",
      "benchmark_case/dependency_delta_02/before/uv.lock"
    ]
  },
  "fixtures": [],
  "oracle": {
    "adapter": "command",
    "identity": {
      "id": "dependency_delta-02-oracle",
      "version": "1"
    },
    "configuration": {
      "health_argv": [
        "{python}",
        "{suite}/oracle.py",
        "health",
        "dependency_delta-02"
      ],
      "grade_argv": [
        "{python}",
        "{suite}/oracle.py",
        "grade",
        "dependency_delta-02"
      ],
      "valid_exit_codes": [
        0,
        1
      ],
      "result_format": "lexigram-v1",
      "timeout_seconds": 30
    }
  },
  "budgets": {
    "timeout_seconds": 600,
    "max_tool_calls": 100,
    "max_output_bytes": 50000000
  },
  "contamination": {
    "allowed_change_globs": [],
    "allowed_generated_globs": [
      "**/__pycache__/**",
      ".pytest_cache/**"
    ]
  }
}
