{
  "budgets": {
    "max_output_bytes": 50000000,
    "max_tool_calls": 100,
    "timeout_seconds": 600
  },
  "contamination": {
    "allowed_change_globs": [],
    "allowed_generated_globs": [
      "**/__pycache__/**",
      ".pytest_cache/**"
    ]
  },
  "family": "dependencies",
  "fixtures": [
    {
      "artifact": "fixtures/dependencies-05.json",
      "sha256": "77905ef738037a10a3b116633761259076467f73170639a039db71863dfb99e2",
      "target": "fixtures/dependencies-05.json"
    }
  ],
  "id": "dependencies-05",
  "mode": "read_only",
  "mutation": null,
  "oracle": {
    "adapter": "expected-json",
    "configuration": {
      "expected": {
        "consumer": "src/doctor_scheduler_solver_service/request_intents.py",
        "import_owner": "unknown",
        "selected_version": "2.5.0"
      }
    },
    "identity": {
      "id": "dependencies-05-oracle",
      "version": "1"
    }
  },
  "prompt": "Inspect the caller-supplied dependency observation in fixtures/dependencies-05.json. Find the pinned source declaration of its consumer_symbol and identify the selected version. Report import ownership as unknown unless independent evidence proves it. Return exactly one JSON object with keys consumer, selected_version, import_owner, and no other text.",
  "repository": {
    "commit": "6d1080136d54fb6da142dff2e302b31da69cd345",
    "tree": "e91dbeaaaf100e2c673308ebca7d0325a314e9a0",
    "url": "https://github.com/Hugloss/doctor-scheduler-core.git"
  },
  "version": 1
}
