{
  "budgets": {
    "max_output_bytes": 50000000,
    "max_tool_calls": 100,
    "timeout_seconds": 600
  },
  "contamination": {
    "allowed_change_globs": [],
    "allowed_generated_globs": [
      "**/__pycache__/**",
      ".pytest_cache/**"
    ]
  },
  "family": "logs",
  "fixtures": [
    {
      "artifact": "fixtures/logs-03.txt",
      "sha256": "97cdf030e22e2731972a3c757db5e7c6c80dc9c661ee26a4664c489690f60d19",
      "target": "fixtures/logs-03.log"
    }
  ],
  "id": "logs-03",
  "mode": "read_only",
  "mutation": null,
  "oracle": {
    "adapter": "expected-json",
    "configuration": {
      "expected": {
        "frame_count": 2,
        "path": "ux/src/domain/reads/readInvalidation.ts",
        "runtime_source_match": "unknown",
        "symbol": "readScopesInvalidatedByMutation"
      }
    },
    "identity": {
      "id": "logs-03-oracle",
      "version": "1"
    }
  },
  "prompt": "Inspect fixtures/logs-03.log. Count the stack frames in the ERROR observation, locate its repository implementation, and state whether this export proves runtime source-byte equivalence. Return exactly one JSON object with keys path, symbol, frame_count, runtime_source_match, and no other text.",
  "repository": {
    "commit": "fbfad7ad14d96d2cb51a6da931b0fb1a60f66e9d",
    "tree": "3ded8be71da0ac93700dcf3a3af76eb172e75ff8",
    "url": "https://github.com/Hugloss/uv-fleet-updater.git"
  },
  "version": 1
}
