{
  "id": "post_change-02",
  "version": 1,
  "family": "post_change",
  "mode": "read_only",
  "repository": {
    "url": "https://github.com/Hugloss/agentsCookbook.git",
    "commit": "844dfa06d50b2f4402306b16a217b29946a3dedf",
    "tree": "c9e4687f45836f0e9254f3d9e6258f737686e76a"
  },
  "prompt": "Inspect benchmark_case/post_change_02. The reported path was rewritten with identical bytes. Decide which prior evidence needs replacement. Return exactly one JSON object with keys change, invalidated, revision_reusable; use repository-relative paths and no other text.",
  "mutation": {
    "id": "post_change-02-baseline",
    "artifact": "mutations/post_change-02.patch",
    "sha256": "c8a1e8ab49051d8719818e041262bff9953c143d96756c077d7174dffa33f5f8",
    "changed_paths": [
      "benchmark_case/post_change_02/observations/report.json",
      "benchmark_case/post_change_02/src/owner.py",
      "benchmark_case/post_change_02/tests/test_owner.py"
    ]
  },
  "fixtures": [],
  "oracle": {
    "adapter": "command",
    "identity": {
      "id": "post_change-02-oracle",
      "version": "1"
    },
    "configuration": {
      "health_argv": [
        "{python}",
        "{suite}/oracle.py",
        "health",
        "post_change-02"
      ],
      "grade_argv": [
        "{python}",
        "{suite}/oracle.py",
        "grade",
        "post_change-02"
      ],
      "valid_exit_codes": [
        0,
        1
      ],
      "result_format": "lexigram-v1",
      "timeout_seconds": 30
    }
  },
  "budgets": {
    "timeout_seconds": 600,
    "max_tool_calls": 100,
    "max_output_bytes": 50000000
  },
  "contamination": {
    "allowed_change_globs": [],
    "allowed_generated_globs": [
      "**/__pycache__/**",
      ".pytest_cache/**"
    ]
  }
}
