{
  "id": "post_change-03",
  "version": 1,
  "family": "post_change",
  "mode": "read_only",
  "repository": {
    "url": "https://github.com/Hugloss/agentsCookbook.git",
    "commit": "844dfa06d50b2f4402306b16a217b29946a3dedf",
    "tree": "c9e4687f45836f0e9254f3d9e6258f737686e76a"
  },
  "prompt": "Inspect benchmark_case/post_change_03. The supplied prior packet has a changed context identity. Decide whether its retained ownership and verification can be reused. Return exactly one JSON object with keys prior_packet, reuse, next_evidence; use repository-relative paths and no other text.",
  "mutation": {
    "id": "post_change-03-baseline",
    "artifact": "mutations/post_change-03.patch",
    "sha256": "c2b53973db6e2a518ab445aae70dc8509afa62b70e76f6de3497533fd7a75c31",
    "changed_paths": [
      "benchmark_case/post_change_03/observations/prior.json",
      "benchmark_case/post_change_03/src/owner.py"
    ]
  },
  "fixtures": [],
  "oracle": {
    "adapter": "command",
    "identity": {
      "id": "post_change-03-oracle",
      "version": "1"
    },
    "configuration": {
      "health_argv": [
        "{python}",
        "{suite}/oracle.py",
        "health",
        "post_change-03"
      ],
      "grade_argv": [
        "{python}",
        "{suite}/oracle.py",
        "grade",
        "post_change-03"
      ],
      "valid_exit_codes": [
        0,
        1
      ],
      "result_format": "lexigram-v1",
      "timeout_seconds": 30
    }
  },
  "budgets": {
    "timeout_seconds": 600,
    "max_tool_calls": 100,
    "max_output_bytes": 50000000
  },
  "contamination": {
    "allowed_change_globs": [],
    "allowed_generated_globs": [
      "**/__pycache__/**",
      ".pytest_cache/**"
    ]
  }
}
