{
  "id": "locate-run-poll-delay",
  "version": 1,
  "family": "typescript-localization",
  "mode": "read_only",
  "repository": {
    "url": "https://github.com/Hugloss/uv-fleet-updater.git",
    "commit": "fbfad7ad14d96d2cb51a6da931b0fb1a60f66e9d",
    "tree": "3ded8be71da0ac93700dcf3a3af76eb172e75ff8"
  },
  "prompt": "Without editing files, identify the frontend function that calculates the polling delay from the number of failures. Return exactly one JSON object with keys path and symbol, and nothing else.",
  "mutation": null,
  "oracle": {
    "adapter": "expected-json",
    "identity": {
      "id": "locate-run-poll-delay-oracle",
      "version": "1"
    },
    "configuration": {
      "expected": {
        "path": "ux/src/domain/fleet/runLifecycle.ts",
        "symbol": "runPollDelay"
      }
    }
  },
  "budgets": {
    "timeout_seconds": 600,
    "max_tool_calls": 100,
    "max_output_bytes": 50000000
  },
  "contamination": {
    "allowed_change_globs": [],
    "allowed_generated_globs": [
      "**/__pycache__/**",
      ".pytest_cache/**"
    ]
  }
}
